,titulos,links,noticia,image,abstract
0,"Encontro de contas com Estado é positivo, diz Cettolin",https://www.jornaldocomercio.com/_conteudo/politica/2018/07/639508-encontro-de-contas-com-estado-e-positivo-diz-cettolin.html,"O prefeito de Garibaldi, Antonio Cettolin (MDB), assumiu a presidência da Federação das Associações dos Municípios do Rio Grande do Sul (Famurs), em meio à divulgação de duas notícias que atendem a demandas dos prefeitos e prefeitas. Uma é a possibilidade de se realizar encontro de contas entre o que o Estado deve em saúde aos municípios e as dívidas que estes tenham com o Estado e estejam no Cadastro Informativo das Pendências perante Órgãos e Entidades da Administração Estadual (Cadin). A assinatura do decreto foi formalizada pelo governador José Ivo Sartori (MDB) no congresso da entidade.""Estando no Cadin o município fica totalmente comprometido, passa a não receber mais verbas estaduais, até mesmo as federais compromete, é uma situação muito delicada"", explica Cittolin. Ele projeta que a medida beneficiará não apenas os municípios devedores, mas também os que não têm débitos com o Estado e poderão realizar esse encontro de contas recebendo em troca algum bem. ""(Essa demanda) atende a todos e vem ao encontro de melhorar muito a vida dos municípios"", completa.A outra medida é a expectativa de uma nova regulamentação que permitirá às agroindústrias familiares, que atualmente fazem parte do Sistema de Inspeção Municipal (SIM), migrarem para o Sistema Unificado Estadual de Sanidade Agroindustrial Familiar, Artesanal e de Pequeno Porte (Susaf) e, com isso, ampliar a área de comercialização de seus produtos para todo o Estado. ""Isso é um grande ganho para todos, porque vai gerar mais emprego, mais renda, tudo isso vai possibilitar um grande desenvolvimento"", comemora.Nesta entrevista ao <strong>Jornal do Comércio - O que a Famurs pretende tratar como pautas prioritárias no Estado?</strong><strong>Antonio Cettolin -</strong><strong>JC - Essa demanda atende inclusive aos municípios que não estejam no Cadin?</strong><strong>Cettolin -</strong><strong>JC - O decreto prevê a compensação do que o Estado deve na área de saúde aos municípios. Mas o que esses municípios deviam ao Estado?</strong><strong>Cettolin -</strong><strong>JC - E além da questão financeira, de não precisar pagar porque tem a receber também, facilita em outros sentidos, financiamentos, empréstimos?</strong><strong>Cettolin -</strong><strong>JC - Que outra demanda a Famurs vai trabalhar com o Estado?</strong><strong>Cettolin -</strong><strong>JC - O que muda para os municípios com o decreto e com o ingresso no Susaf?</strong><strong>Cettolin -</strong><strong>JC - Esses profissionais que farão a inspeção serão vinculados ao município?</strong><strong>Cettolin -</strong><strong>JC - Cada município tem que fazer a sua regulamentação?</strong><strong>Cettolin -</strong><iframe allowfullscreen=""allowfullscreen"" frameborder=""0"" height=""315"" src=""https://www.youtube.com/embed/0v931_mBdrs"" style=""display: block; margin-left: auto; margin-right: auto;"" width=""560""></iframe><strong>JC - Isso são demandas ao Executivo. Por outro lado, em ano eleitoral, os legislativos costumam reduzir o ritmo de trabalho no período de campanha. Como a Famurs pretende fazer a articulação de pautas junto aos parlamentares?</strong><strong>Cettolin -</strong><strong>JC - Nesse período pré-campanha, o que a Famurs busca dos candidatos ao governo do Estado, alguma pauta específica que esperam que eles se comprometam?</strong><strong>Cettolin -</strong><strong>JC - Já há itens formulados?</strong><strong>Cettolin -</strong><strong>JC - Quando o ex-presidente da Famurs Salmo Dias (PP) assumiu, falou de uma pauta que é recorrente, dos municípios sem acesso asfáltico. Essa é uma das demandas?</strong><strong>Cettolin -</strong><strong>JC - Isso em relação ao governo do Estado. E em relação ao governo federal, os municípios têm alguma pauta principal e vão buscar esse compromisso dos candidatos?</strong><strong>Cettolin -</strong><strong>JC - Em relação ao pacto federativo, mesmo que haja compromisso dos candidatos à presidência, é um tema que tem que passar pelo Congresso. Acredita que o início do próximo ano legislativo é um bom momento para tentar pautar isso? Se fala que pautas que tenham um impacto muito grande, o melhor é apreciar no começo...</strong><strong>Cettolin -</strong>",lp_100718___especial_antonio__8_-8397819.jpg,Prefeito de Garibaldi assumiu a presidência da Famurs
0,PSOL lança Roberto Robaina e Professora Camila ao governo do Estado,https://www.jornaldocomercio.com/_conteudo/politica/2018/07/639636-psol-lanca-roberto-robaina-e-professora-camila-ao-governo-do-estado.html,"O Partido Socialismo e Liberdade (PSOL) lançou neste domingo (22) os nomes de Roberto Robaina e Camila Goulart à candidatura ao governo do Rio Grande do Sul. A chapa da coligação “Independência e Luta para mudar o Rio Grande (PSOL-PCB)” confirmou ainda as candidaturas ao Senado de Romer Guex (PSOL) e de Cleber Soares (PCB).Robaina é vereador de Porto Alegre e graduado em História e doutor em Filosofia. Já a vice Camila é professora de História da rede estadual gaúcha.“Vamos mostrar que é possível governar o Rio Grande do Sul de outra forma, sem atacar os servidores públicos. Queremos fortalecer uma política de segurança pública que respeite a comunidade e não tenha como alvo massacrar a juventude pobre da periferia, valorizando os policiais e combatendo prioritariamente os crimes contra a vida”, afirmou Robaina. Durante a convenção também prometeu “combater a sonegação e as isenções fiscais e defender a suspensão do pagamento da dívida do estado com a União e a revogação da Lei Kandir”.A convenção do partido oficializou a lista de 76 candidatos, sendo 27 ao cargo de deputado estadual e 46 a de deputado federal. A lista para o Parlamento gaúcho será liderada pelo deputado estadual Pedro Ruas, candidato à reeleição, e pela ex-deputada Luciana Genro. Também irá concorrer o agrônomo Jurandir Silva, liderança do PSOL em Pelotas e suplente de deputado estadual.Para o Congresso Nacional, o PSOL vai apostar na candidatura de Fernanda Melchionna, vereadora mais votada de Porto Alegre. A lista também tem a candidatura do vereador de Porto Alegre Professor Alex Fraga, da vereadora de Pelotas Fernanda Miranda e do vereador de Viamão Guto Lopes.",mq220718_psol22-8412706.jpg,Convenção do partido oficializou também lista de 76 candidatos a deputados federais e estaduais
0,"Deputado Bernardo Carli, do Paraná, morre em acidente de avião",https://www.jornaldocomercio.com/_conteudo/geral/2018/07/639628-deputado-bernardo-carli-do-parana-morre-em-acidente-de-aviao.html,"O deputado estadual Bernardo Carli (PSDB), do Paraná, morreu neste domingo (22) após um acidente de avião no município de Paula Freitas, sul do estado. O avião havia decolado no município de Guarapuava e seguia para a União da Vitória, onde teria um compromisso político.Ainda não há informações sobre o número de vítimas do acidente. Mas assessores do deputado e do PSDB confirmam a morte do deputado.Uma equipe da aeronáutica foi deslocada para o local do acidente para periciar a aeronave. Equipes do Corpo de Bombeiros também foram deslocadas para o local do acidente, situado numa região de difícil acesso.Em uma rede social, o presidente estadual do PSDB, ex-governador Berto Richa, lamentou a morte do companheiro de partido.""Profundamente abalado com a notícia da trágica morte do amigo e jovem deputado Bernardo Ribas Carli. Que Deus, na sua imensa benevolência, conforte a família neste momento de grande dor"", afirmou.Bernardo rinha 32 anos e cumpria o seu segundo mandato como deputado estadual. De família de políticos, ele era filho do ex-prefeito de Guarapuava, Luiz Fernando Ribas Carli, e irmão do ex-deputado estadual Luiz Fernando Ribas Carli Filho.",715_o_imagem4866-8412417.jpg,Avião havia decolado no município de Guarapuava e seguia para a União da Vitória
0,Temer vai ao México para reunião de Mercosul e Aliança do Pacífico,https://www.jornaldocomercio.com/_conteudo/politica/2018/07/639621-temer-vai-ao-mexico-para-reuniao-de-mercosul-e-alianca-do-pacifico.html,"O presidente Michel Temer viaja nesta segunda-feira (23) para o México, onde vai participar de encontro com outros chefes de Estado do Mercosul e da Aliança do Pacífico. Assim como ocorreu outras vezes durante o período pré-eleitoral, a presidente do Supremo Tribunal Federal, ministra Cármen Lúcia, assumirá a Presidência.Temer vai participar da 1ª Reunião de Presidentes do Mercosul e da Aliança do Pacífico, na cidade de Puerto Vallarta. O Mercosul e a Colômbia devem assinar um acordo de serviços. Já o país anfitrião e o Brasil devem assinar um tratado sobre Cooperação em Assistência Administrativa Mútua.Amanhã (23), o presidente brasileiro terá um encontro reservado com o mandatário mexicano, Enrique Peña Nieto. Depois, participará de jantar oferecido aos chefes de Estado. Com a possibilidade de ser assinado no futuro um acordo entre a Aliança do Pacífico e o Mercosul, o Brasil é um dos principais interessados na parceria, já que ainda não possui acordo de livre comércio com o México.Temer retorna para Brasília na terça-feira (24). Terceira na linha sucessória da Presidência da República, Cármen Lúcia assumirá a cadeira pela quarta vez este ano. Como o cargo de vice-presidente está vago, a primeira pessoa da linha sucessória é o presidente da Câmara dos Deputados, Rodrigo Maia (DEM-RJ), e o segundo, o do Senado, Eunício Oliveira (PMDB-CE).Uma vez que a legislação eleitoral impede a candidatura de ocupantes de cargos no Executivo nos seis meses que antecedem as eleições, os presidentes da Câmara e do Senado também precisarão se ausentar do país. Diferentemente de outras ocasiões, quando participaram de compromissos oficiais, dessa vez eles farão viagens particulares.Eunício vai para Miami, nos Estados Unidos. Rodrigo Maia também fará uma viagem pessoal, mas o destino ainda não foi informado por sua assessoria de imprensa. ",0,"A presidente do Supremo Tribunal Federal, ministra Cármen Lúcia, assumirá a Presidência"
0,Bolsonaro é oficializado candidato e fala que é o 'patinho feio' da eleição,https://www.jornaldocomercio.com/_conteudo/politica/2018/07/639620-bolsonaro-e-oficializado-candidato-e-fala-que-e-o-patinho-feio-da-eleicao.html,"O Partido Social Liberal (PSL) oficializou neste domingo (22) a candidatura do deputado federal Jair Bolsonaro à Presidência da República, em convenção nacional, no Rio de Janeiro, em meio a indefinições sobre o nome escolhido para compor a chapa no cargo de vice. Em seu discurso, Bolsonaro disse que não é o salvador da pátria e que sabe que está causando desconforto nas eleições 2018. ""Sou o patinho feio dessa história"", afirmou.Ovacionado sob gritos de ""Mito!"" e ""Eu vim de graça!"", Bolsonaro discorreu sobre sua trajetória profissional. Ele também criticou novamente, como outros pré-candidatos à Presidência, o acordo de Geraldo Alckmin (PSDB) com o Centrão. ""Alckmin uniu a escória da política brasileira"", disse em alusão à aliança que rendeu ao tucano o maior tempo de TV entre os presidenciáveis.""O Brasil não aguenta mais 4 anos de PT ou PSDB. Vamos unir esse Brasil, brancos e negros, homos e héteros, nordestinos e sulistas, ricos e pobres, patrões e empregados"", disse.O evento, que começou no fim da manhã, reúne partidários do presidenciável num centro de convenções na região central da cidade. A estimativa é de 2.500 pessoas.Jair Bolsonaro se emocionou com a recepção calorosa de seus partidários e chorou quando foi executado o hino brasileiro. Muitos apoiadores tinham as cores verde e amarela e estavam com bandeiras do Brasil.Cotada como possível vice, a advogada Janaína Paschoal foi a segunda pessoa mais aplaudida em sua chegada à convenção. Ela discursou pedindo moderação e tolerância, criticou a defesa de um pensamento único e afirmou ser necessário pensar na governabilidade. ""A minha fidelidade não é ao deputado Jair Bolsonaro. A minha fidelidade é ao meu País"", disse.""Ainda não decidi sobre o convite para a integrar a chapa como vice"", afirmou. ""A possibilidade muito me honra. Mas algo tão sério precisa ser bem discutido"", afirmou. Segundo ela, é preciso pensar na campanha, mas também na governabilidade caso saiam vitoriosos do leito. ""Enquanto procuramos pessoas que estejam dentro da totalidade do nosso pensamento, eles estão se unindo"", alertou.O senador Magno Malta, que também já teve o nome cotado para figurar como vice na chapa de Bolsonaro, discursou em apoio ao presidenciável. Malta preferiu se candidatar novamente ao Senado do que concorrer na chapa com o PSL.""O que o Brasil quer e o que eu quero é um homem de mãos limpas, e você tem mãos limpas. E um homem cristão, você é cristão. O Brasil quer um homem que tem sangue no olho para enfrentar vagabundo"", disse Malta a Jair Bolsonaro.Na convenção, também serão oficializadas as candidaturas do filho mais velho do presidenciável, Flávio Bolsonaro, que tentará eleição como senador, e demais escolhidos pelo partido para concorrer aos cargos de deputado estadual e federal pelo Rio de Janeiro.",000_17v0sw-8412185.jpg,"Em discurso, presidenciável disse que não é o salvador da pátria e que sabe que está causando desconforto no pleito"
0,PSL faz convenção neste domingo para lançar candidatura de Bolsonaro,https://www.jornaldocomercio.com/_conteudo/politica/2018/07/639615-psl-faz-convencao-neste-domingo-para-lancar-candidatura-de-bolsonaro.html,"O Partido Social Liberal (PSL) faz neste domingo (22), no Rio de Janeiro, convenção nacional para lançar a candidatura do deputado federal Jair Bolsonaro à Presidência da República. É esperado o anúncio de quem irá compor a chapa com o parlamentar. A advogada Janaína Paschoal sinalizou, na sua conta no Twitter, que tem disposição de ser vice na chapa encabeçada pelo parlamentar.Na quarta-feira passada (18), o Partido Republicano Progressista (PRP), ao qual o general Augusto Heleno é filiado, se recusou a indicar o militar para vice. Antes disso, o PR tinha descartado a indicação do senador Magno Malta (PR) para compor a chapa com Bolsonaro.Além da confirmação do candidato à Presidência, será realizada também a Convenção Estadual para lançamento das chapas para deputados estaduais e federais e do nome de Flávio Bolsonaro (atualmente no segundo mandato como depuado estadual pelo Rio de Janeiro) para a disputa ao Senado. Os trabalhos da Convenção serão conduzidos pelo presidente nacional do partido Gustavo Bebianno e pelo vice, Julian Lemos. Já estão confirmadas as participações de correligionários e dirigentes partidários de todos os estados. O término das convenções está previsto para às 17h. Os organizadores que estimam a presença de, aproximadamente, 2,5 mil pessoas de diversos estados do país, foram instalados telões no espaço do Centro de Convenções Sulamérica, na Cidade Nova, região central do Rio, para que os participantes possam acompanhar melhor a programação e os discursos. A programação poderá ser assistida também por meio das redes sociais do partido e da família do deputado.Jair Messias Bolsonaro, 63 anos, foi o candidato a deputado federal mais votado no Rio de Janeiro, nas eleições de 2014, com 464 mil votos. Casado três vezes, tem cinco filhos e uma carreira de 25 anos ininterruptos no Congresso.",jh290617_transposul_3343-1577214.jpg,É esperado o anúncio de quem irá compor a chapa com o parlamentar
0,Bolsonaro diz que Alckmin juntou a 'nata de tudo que não presta no Brasil',https://www.jornaldocomercio.com/_conteudo/politica/2018/07/639611-bolsonaro-diz-que-alckmin-juntou-a-nata-de-tudo-que-nao-presta-no-brasil.html,"O pré-candidato do PSL à Presidência, o deputado federal Jair Bolsonaro (RJ) criticou neste sábado (21), seu adversário e ex-governador Geraldo Alckmin (PSDB) por firmar um acordo com o Centrão, grupo que reúne DEM, PP, PR, SD e PRB. ""Quero cumprimentar o Alckmin. Ele juntou alta nata de tudo que não presta no Brasil do lado dele"", afirmou na Vila Militar no bairro de Deodoro, no Rio de Janeiro.Bolsonaro, que participava de evento de formatura de paraquedistas no Exército, disse que não se referia aos parlamentares dessas siglas, mas ao grupo que ""decide a situação"". Outros presidenciáveis também criticaram o acordo.O deputado tentava até a semana passada ter o PR ao seu lado e chegou a negociar com Valdemar Costa Neto, líder da sigla, uma aliança. Ele desejava ter o senador Magno Malta (PR-ES) como vice em sua chapa. O PR, porém, desistiu de apoiá-lo e entrou nas negociações do Centrão com Alckmin.Bolsonaro classificou o rival tucano como um ""general sem tropa"". Segundo ele, 40% dos deputados que compõem as bancadas de DEM, PP, PR, SD e PRB estarão com ele quando for eleito.""Eles têm um compromisso de governabilidade sem o ""toma lá, dá cá"" conosco"", disse. O deputado voltou a dizer que, uma vez na presidência, a governabilidade virá sem troca de apoio no Congresso por cargos na estrutura do governo.""Se é para fazer a mesma coisa, não vote em mim. Eu não quero conversar com Sergio Moro em Curitiba. Simples o negócio"", disse. ""Agora, vocês da imprensa falam tanto que tem de ter governabilidade dessa forma. Essa forma de governar é que levou o Brasil a essa ineficiência e essa corrupção não encontrada em nenhum lugar do mundo"", afirmou.Após as conversas com o PR naufragarem, Bolsonaro tentou um acordo com o PRP para que o general Augusto Heleno, militar da reserva e seu aliado, pudesse compor sua chapa, mas o partido também declinou a proposta. Heleno também estava na solenidade. Líder nas pesquisas no cenário que desconsidera o ex-presidente Lula, Bolsonaro segue sem vice e sem alianças partidárias.",0,Outros presidenciáveis também criticaram o acordo.
0,Pré-candidatos criticam acordo de Geraldo Alckmin com o Centrão,https://www.jornaldocomercio.com/_conteudo/politica/2018/07/639607-pre-candidatos-criticam-acordo-de-geraldo-alckmin-com-o-centrao.html,"Um dia após o acordo entre o presidenciável Geraldo Alckmin (PSDB) e o Centrão, bloco composto por DEM, PP, PR, PRB e SD, pré-candidatos usaram as redes sociais para condenarem a aliança que dá ao tucano o maior tempo de TV nas eleições 2018. Juntos, as siglas do Centrão somam 164 deputados e agregam quase cinco minutos por dia no horário eleitoral.O senador Alvaro Dias, presidenciável pelo Podemos e cogitado como vice na chapa de Geraldo Alckmin em diversas ocasiões ao longo da pré-campanha, afirmou que não estava arrependido da decisão.Dias afirmou no sábado que o presidencialismo de coalizão fracassou no Brasil e vive uma crise sem precedentes. ""Não creio que a solução seja esse amontoado de siglas em nome de tempo de TV que, muitas vezes, é para dar explicações das próprias incoerências mais do que apresentar propostas que dizem respeito ao interesse nacional"", afirmou. ""Essa coalizão de siglas é a fotografia do sistema fracassado que devemos substituir, um monstro que tem de ser combatido"", disse.Em evento com militares no Rio, o deputado federal Jair Bolsonaro (PSL) foi irônico ao falar sobre o acordo. ""Quero parabenizar o Alckmin. Ele reuniu a nata de tudo que não presta no Brasil ao lado dele"", afirmou, segundo o jornal O Globo.Guilherme Boulos, oficializado pelo PSOL na tarde de sábado como candidato do partido à Presidência, afirmou que o Centrão é a soma de partidos ""sem nenhum projeto político"". ""Se unem nos negócios, no balcão que troca apoio parlamentar por cargos. Ninguém que se aliar com eles poderá oferecer algo novo ao País"", escreveu no Twitter.Sem falar diretamente sobre o acordo selado, Marina Silva publicou um vídeo na quinta em suas redes sociais dizendo que sua campanha não faria alianças ""oportunistas"" nem ""eleitoreiras"". ""Nosso compromisso é com os 200 milhões de brasileiros"", afirmou.Pré-candidato do Novo, o empresário João Amoêdo publicou um vídeo no Instagram afirmando que não há nenhuma novidade no acordo entre o tucano e o Centrão. ""Temer, Alckmin, é tudo igual, é a velha política. Em troca de alguns minutos do horário eleitoral, Alckmin se alia a ex-presidiários como o Valdemar da Costa Neto e o Roberto Jefferson (ambos condenados no mensalão)"", afirma.Em seguida, Amoêdo disse que a aliança favorece quem busca ""mordomias"" como jatinhos, assessores e negociatas. Por fim, pede que a população desligue a televisão durante o eleitoral e faça a renovação nas urnas.O PDT de Ciro Gomes esteve bem próximo de consolidar o acordo com o Centrão mas, quando o grupo ""mudou de lado"", adotou outro discurso. O presidente da sigla, Carlos Lupi, ao ser questionado se não tiraram o doce da boca da criança, respondeu que ""o doce poderia estar estragado"". Agora, Ciro mantém as negociações com PSB e PCdoB e tenta buscar aliados na esquerda.As negociações entre o Centrão e os pré-candidatos duraram semanas e estiveram muito próximas de um desfecho diferente. Em um momento, o contexto levava a crer que os partidos apoiariam Ciro Gomes. Segundo apurou o Estado, declarações de Ciro como o xingamento contra uma promotora e a injúria racial contra o vereador paulistano Fernando Holiday, do DEM, teriam pesado contra o pedetista. O discurso econômico, diferente do que defende boa parte dos liberais do Centrão, também teria sido desfavorável ao pré-candidato.O bloco dos cinco partidos ofereceu Josué Gomes (PR), filho do ex-vice-presidente José de Alencar, como vice na chapa de Geraldo Alckmin, além de ter exigido a recondução de Rodrigo Maia, do DEM, à presidência da Câmara dos Deputados, caso o deputado e Alckmin sejam eleitos. O acordo deve ser anunciado oficialmente apenas na quinta-feira (26).",0,Siglas do Centrão somam 164 deputados e agregam quase cinco minutos no horário eleitoral
0,Bolsonaro volta a posar com criança fazendo sinal de arma,https://www.jornaldocomercio.com/_conteudo/politica/2018/07/639606-bolsonaro-volta-a-posar-com-crianca-fazendo-sinal-de-arma.html,"Um dia após ser criticado por estar ""ensinando"" uma criança a imitar uma arma com as mãos, o deputado federal e presidenciável Jair Bolsonaro (PSL) apareceu na manhã deste sábado (21) em evento público posando com uma criança no colo fazendo o sinal de uma arma.Jair Bolsonaro participou de um evento com militares no bairro de Deodoro, na zona oeste do Rio, onde aproveitou para criticar a decisão do pré-candidato Geraldo Alckmin (PSDB) se aliar com o Centrão, bloco formado por PP, PRB, DEM, SD e PR.Na quinta, o pré-candidato publicou um vídeo gravado em Goiânia em que ensina uma menina a fazer o gesto de uma arma com as mãos. As imagens causaram polêmica nas redes sociais, inclusive entre outros pré-candidatos ao Palácio do Planalto.Na ocasião, ele foi criticado por outros presidenciáveis como Marina Silva (Rede) e Manuela D'Ávila (PCdoB). Marina afirmou ter ficado ""estarrecida"" com a situação, enquanto Manuela chamou o pré-candidato de ""inominável"" e qualificou a imagem como violenta.",pol_jair_bolsonaro__5_-8369001.jpg,Bolsonaro reaapareceu posando com uma criança no colo fazendo o sinal de uma arma
